{
  "engineId": "ENG-001",
  "missionId": "MSN-OILPRESS-001",
  "correlationId": "corr-8f3a1c",
  "estimateTime": "2026-08-22T09:14:33.000Z",
  "producerVersion": "rul-reg-0.1.0",
  "cycles": 340,
  "lowerBound": 260,
  "upperBound": 410,
  "trend": "DEGRADING",
  "experimental": true,
  "basis": "ML_REGRESSION"
}
